"136",161,2494,"","Genetic diversity of wild and managed honey bees (Apis mellifera) in Southwestern Pennsylvania, and prevalence of the microsporidian gut pathogens Nosema ceranae and N. apis","Rangel, J; Traver, B; Stoner, M; Hatter, A; Trevelline, B; Garza, C; Shepherd, T; Seeley, TD; Wenzel, J","The populations of wild honey bee (Apis mellifera) colonies in the USA were decimated after the arrival of a parasitic mite Varroa destructor in the 1980s. However, in some places, wild honey bee colonies survived. In this 3-year study, we analyzed 32 wild and 11 managed colonies in Southwestern Pennsylvania for their maternal genetic ancestries and their levels of Nosema spp. infection. We detected nine mtDNA haplotypes in the 32 wild colonies sampled: six belonged to the Eastern European lineage (C) and three belonged to the Western European lineage (M). We found only three mtDNA haplotypes in the eleven managed colonies sampled, all belonging to the C lineage. Infection levels of N. ceranae were relatively high and fluctuated over time while those of N. apis remained relatively low and constant. There were no differences in N. ceranae or N. apis levels between wild and managed colonies. This study shows that wild honey bee colonies can represent old lineages despite being susceptible to Nosema.","jrangel@tamu.edu",2020,"10.1007/s13592-020-00762-5","APIDOLOGIE","historical-dna","KC","RC","accept","accept","empirical","diversity","","","","","terrestrial","Insecta","USA","Powdermill Nature Reserve","2017.01.01,2015.01.01,2014.01.01","24,18,30",912,"pre-designed","anthropogenic","invasive_species","disease","","chronic","mtDNA_seq","thorax","ethanol","phenol-chloroform","Sanger","PCR","generation time pulled from: Parejo et al. (2020) Genome Biology & Evolution; actually use RFLP for some of samples (2014 & 2016); not including managed colonies here","2017.01.01","24","18","30",NA,NA,NA,NA,NA,NA,NA,NA,NA,NA,NA,NA,NA,NA,NA,NA,NA,NA,NA,NA,NA,NA,NA,NA,NA,NA,NA,NA,NA,NA,NA,NA,NA,NA,NA,NA,NA,NA,NA,NA,NA,NA,NA,NA,NA,NA,NA,NA,NA,NA,NA,NA,NA,NA,NA,NA,NA,NA,NA,NA,"USA",NA,NA,NA,NA,NA,NA,NA,NA,NA,NA,NA,NA,NA,NA,NA,NA,NA,NA,NA,NA,NA,NA,NA,NA,NA,NA,NA,NA,NA,NA,NA,NA,NA,NA,NA,NA,NA,NA,NA,1.20175438596491,1096,3.0027397260274
"137",162,7732,"","Single base errors in PCR products from avian museum specimens and their effect on estimates of historical genetic diversity","Sefc, KM; Payne, RB; Sorenson, MD","Conservation genetic studies often employ DNA extracts from museum specimens for comparisons with extant populations to monitor temporal changes in genetic diversity. Here, we report on artifact base changes in mitochondrial DNA sequences amplified from relatively recent (<= 35 years) museum specimens of indigobirds (Vidua spp.). Single base errors were confirmed by replicate sequencing and included both double peaks and artifact substitutions at rates of similar to 3 x 10(-4) and similar to 1 x 10(-4) per base- pair, respectively, resulting in one or more errors or ambiguities in an 1100 base pair sequence in 21% of 219 samples. Most errors involved C -> T changes on the L-strand, presumably due to deamination of cytosine in the template. The error rates encountered here bias comparisons of haplotype number between historical and extant populations, such that the `loss' of artifact haplotypes present in a historical sample could be incorrectly attributed to a population decline or bottleneck. Sequencing errors due to miscoding lesions in template DNA have so far been reported only from ancient and formalin-fixed tissue, but they may also affect relatively recent museum samples, as shown here, and perhaps also non-invasive samples that typically yield low-quality DNA.","kristina.sefc@uni-graz.at",2007,"10.1007/s10592-006-9240-8","CONSERVATION GENETICS","ancient-dna","KC","RC","accept","accept","empirical","diversity","","","","","terrestrial","Aves","SouthAfrica,Zimbabwe,Zambia,Malawi,Botswana","Africa","1996.01.01,1969.01.01","103,129",748,"opportunistic","natural","env_variation","","","chronic","mtDNA_seq","feather","dried","Qiagen","Sanger","PCR","modern samples from other study (Sorenson et al. (2003) Nature); 1996 represents 1991-2000, 1969 represents 1966-1973; generation time pulled from: Bird et al. (2020) Conservation Biology","1996.01.01","103","129",NA,NA,NA,NA,NA,NA,NA,NA,NA,NA,NA,NA,NA,NA,NA,NA,NA,NA,NA,NA,NA,NA,NA,NA,NA,NA,NA,NA,NA,NA,NA,NA,NA,NA,NA,NA,NA,NA,NA,NA,NA,NA,NA,NA,NA,NA,NA,NA,NA,NA,NA,NA,NA,NA,NA,NA,NA,NA,NA,NA,NA,"SouthAfrica","Zimbabwe","Zambia","Malawi","Botswana",NA,NA,NA,NA,NA,NA,NA,NA,NA,NA,NA,NA,NA,NA,NA,NA,NA,NA,NA,NA,NA,NA,NA,NA,NA,NA,NA,NA,NA,NA,NA,NA,NA,NA,NA,13.1831550802139,9861,27.0164383561644
"138",163,3318,"","Temporal variation in genetic structure within the threatened spectacled eider","Sonsthagen, S; Haughey, C; Sexson, M; Solovyeva, D; Petersen, M; Powell, A","We examined the genetic structure of the threatened spectacled eider 14-18 years after the initial assessment to evaluate the influence of population recovery on diversity. Concordant with the initial assessment, spectacled eiders were highly structured at mitochondrial (mt) DNA and lacked differentiation at microsatellite loci. The degree and spatial pattern of structure has changed at mtDNA; a 33.0-40.3% reduction in overall F-ST and phi(ST), respectively, and a marked reduction in pairwise F-ST (- 83.1 to - 91.4%) among Alaska sites. Reduction in genetic structure is suggestive of increased female dispersal within Alaska. These findings highlight the importance of reevaluating genetic diversity as species recover from declines as microevolutionary and demographic processes are dynamic and continually shape associations among populations.","ssonsthagen@usgs.gov",2020,"10.1007/s10592-019-01234-9","CONSERVATION GENETICS","temporal-genetics","JW","RC","accept","accept","empirical","diversity","connectivity","","","","other","Aves","Russia,USA","Chaun Delta,Utqiagvik,Colville River,Yukon-Kuskokwim Delta,Yukon-Kuskokwim Delta,Indigirka Delta.Prudhoe Bay","2012.01.01,2011.01.01,2010.01.01,2008.01.01,1996.01.01,1995.01.01","67,68,38,20,23,14.20",1095,"pre-designed","anthropogenic","climate_change","habitat_loss","","chronic","mtDNA_seq","feather,blood",NA,"proteinase-K,Chelex","Sanger","PCR","Y-K Delta sampled in both 1996&2008","2012.01.01","67","68","38","20","23","14.20",NA,NA,NA,NA,NA,NA,NA,NA,NA,NA,NA,NA,NA,NA,NA,NA,NA,NA,NA,NA,NA,NA,NA,NA,NA,NA,NA,NA,NA,NA,NA,NA,NA,NA,NA,NA,NA,NA,NA,NA,NA,NA,NA,NA,NA,NA,NA,NA,NA,NA,NA,NA,NA,NA,NA,NA,NA,"Russia","USA",NA,NA,NA,NA,NA,NA,NA,NA,NA,NA,NA,NA,NA,NA,NA,NA,NA,NA,NA,NA,NA,NA,NA,NA,NA,NA,NA,NA,NA,NA,NA,NA,NA,NA,NA,NA,NA,NA,5.6703196347032,6209,17.0109589041096
"139",164,3398,"","Noninvasive genetic analyses for estimating population size and genetic diversity of the remaining Far Eastern leopard (Panthera pardus orientalis) population","Sugimoto, T; Aramilev, VV; Kerley, LL; Nagata, J; Miquelle, DG; McCullough, DR","Understanding and monitoring the population status of endangered species is vital for developing appropriate management interventions. We used noninvasive genetic analyses to obtain ecological and genetic data on the last remaining Far Eastern leopard population in the world. During seven winters from 2000-2001 to 2007-2008, we collected feces, hair, and saliva from most of the leopard habitat. Of the 239 leopard samples collected during the study period, 155 were successfully genotyped at 13 microsatellite loci and 37 individuals (18 males and 19 females) were identified. Population size estimates based on the Capwire model were 28 (95 % CI 19-38) in 2002-03 and 26 (95 % CI 13-33) in 2007-2008. The leopard population had a low level of genetic diversity (expected and observed heterozygosity = 0.43; average number of alleles per locus = 2.62), and effective population size was estimated to be low (N (e) = 7-16) by two genetic-based methods. We observed little improvement in the genetic diversity during the study period and did find an indication of allele loss compared with individuals from the mid-1990s, suggesting that the remaining population will continue to suffer loss of genetic diversity. Given the small population size and the low genetic diversity, with little expectation of replenishment of the genetic variation by natural immigration, successful expansion of available habitat and development of a second population based on captive individuals may be crucial for persistence of this leopard subspecies in the wild.","tasugi@ees.hokudai.ac.jp",2014,"10.1007/s10592-013-0558-8","CONSERVATION GENETICS","museum-dna","EG","RC","accept","accept","empirical","diversity","popsize","","","","terrestrial","Mammalia","Russia","Southwest Primorskii Krai","2007.01.01,2002.01.01","18,23",1095,"pre-designed","anthropogenic","human_exploitation","habitat_loss","","chronic","microsat","fecal","frozen","GuSCN/silica method","Sanger","PCR","20-30 years between samples.  Same pop?; RC: Only 2001-2003 and 2006-2008 samples were compared temporally; 2007.01.01 represents 2006.12.01-2008.03.01, 2002.01.01 represents 2001.11.01-2003.02.01 (only sampled winter months)","2007.01.01","18","23",NA,NA,NA,NA,NA,NA,NA,NA,NA,NA,NA,NA,NA,NA,NA,NA,NA,NA,NA,NA,NA,NA,NA,NA,NA,NA,NA,NA,NA,NA,NA,NA,NA,NA,NA,NA,NA,NA,NA,NA,NA,NA,NA,NA,NA,NA,NA,NA,NA,NA,NA,NA,NA,NA,NA,NA,NA,NA,NA,NA,NA,"Russia",NA,NA,NA,NA,NA,NA,NA,NA,NA,NA,NA,NA,NA,NA,NA,NA,NA,NA,NA,NA,NA,NA,NA,NA,NA,NA,NA,NA,NA,NA,NA,NA,NA,NA,NA,NA,NA,NA,NA,1.6675799086758,1826,5.0027397260274
"140",165,5958,"","Temporal patterns of genetic diversity in Baetis tricaudatus (Ephemeroptera:Baetidae) from the Russian River, northern California","Stauffer-Olsen, NJ; O'Grady, PM; Resh, VH","The mayfly Baetis tricaudatus is an abundant, widespread, and ecologically important multivoltine benthic macroinvertebrate that is found throughout most of North America. Baetis tricaudatus belongs to the Baetis rhodani species group, which is known to have cryptic species. Some investigators have found that B. tricaudatus morphospecies have cytochrome oxidase I (COI) diversity >20%. However, no investigators have examined whether this diversity is structured temporally, with some haplotypes being more common in certain years or seasons than others. We sequenced COI from 371 B. rhodani specimens. The 371 rhodani species group sequences generated fell into 2 well-supported clades, one with 38 Baetis adonis specimens and another with 333 B. tricaudatus specimens, which were the focus of our study. We examined the temporal and spatial dynamics of genetic diversity in B. tricaudatus populations from northern California using COI haplotype networks. The maximum genetic diversity among B. tricaudatus specimens was 1.7% and was found at a single site (Austin Creek). The same 2 dominant haplotypes of B. tricaudatus were consistent through years, sites, and seasons, and Phi(ST) values were correspondingly low. In 2 intensive sampling events, each with >40 individuals examined, intrapopulational divergence was 1.2 to 1.4%. This result suggests that most of the genetic diversity for this species in this system could be captured in 1 high-effort sampling event rather than in smaller, long-term monitoring events. Our results suggest that, based on the sites examined, Russian River populations of B. tricaudatus constitute a single species with no evidence of cryptic diversity.","natjst@berkeley.edu; ogrady@drosophilaevolution.com; resh@berkeley.edu",2017,"10.1086/691973","FRESHWATER SCIENCE","museum-dna","ACS","RC","accept","accept","empirical","diversity","","","","","other","Insecta","USA","Rsusian River","2015.01.01,2014.01.01,2013.01.01,2012.01.01","127,113,89,4",122,"pre-designed","natural","env_variation","","","chronic","mtDNA_seq","whole","ethanol","Qiagen","Sanger","PCR","generation time estimated from: http://www.ephemeroptera-galactica.com/pubs/pub_b/pubbrittainj1982p119.pdf (roughly 3 generations/year)","2015.01.01","127","113","89","4",NA,NA,NA,NA,NA,NA,NA,NA,NA,NA,NA,NA,NA,NA,NA,NA,NA,NA,NA,NA,NA,NA,NA,NA,NA,NA,NA,NA,NA,NA,NA,NA,NA,NA,NA,NA,NA,NA,NA,NA,NA,NA,NA,NA,NA,NA,NA,NA,NA,NA,NA,NA,NA,NA,NA,NA,NA,NA,NA,"USA",NA,NA,NA,NA,NA,NA,NA,NA,NA,NA,NA,NA,NA,NA,NA,NA,NA,NA,NA,NA,NA,NA,NA,NA,NA,NA,NA,NA,NA,NA,NA,NA,NA,NA,NA,NA,NA,NA,NA,8.98360655737705,1096,3.0027397260274
"141",166,3911,"","Genetic implications of bottleneck effects of differing severities on genetic diversity in naturally recovering populations: An example from Hawaiian coot and Hawaiian gallinule","Sonsthagen, SA; Wilson, RE; Underwood, JG","The evolutionary trajectory of populations through time is influenced by the interplay of forces (biological, evolutionary, and anthropogenic) acting on the standing genetic variation. We used microsatellite and mitochondrial loci to examine the influence of population declines, of varying severity, on genetic diversity within two Hawaiian endemic waterbirds, the Hawaiian coot and Hawaiian gallinule, by comparing historical (samples collected in the late 1800s and early 1900s) and modern (collected in 2012-2013) populations. Population declines simultaneously experienced by Hawaiian coots and Hawaiian gallinules differentially shaped the evolutionary trajectory of these two populations. Within Hawaiian coot, large reductions (between -38.4% and -51.4%) in mitochondrial diversity were observed, although minimal differences were observed in the distribution of allelic and haplotypic frequencies between sampled time periods. Conversely, for Hawaiian gallinule, allelic frequencies were strongly differentiated between time periods, signatures of a genetic bottleneck were detected, and biases in means of the effective population size were observed at microsatellite loci. The strength of the decline appears to have had a greater influence on genetic diversity within Hawaiian gallinule than Hawaiian coot, coincident with the reduction in census size. These species exhibit similar life history characteristics and generation times; therefore, we hypothesize that differences in behavior and colonization history are likely playing a large role in how allelic and haplotypic frequencies are being shaped through time. Furthermore, differences in patterns of genetic diversity within Hawaiian coot and Hawaiian gallinule highlight the influence of demographic and evolutionary processes in shaping how species respond genetically to ecological stressors.","ssonsthagen@usgs.gov",2017,"10.1002/ece3.3530","ECOLOGY AND EVOLUTION","historical-dna","EG","RC","accept","accept","empirical","diversity","popsize","","","","other","Aves","USA","Oahu","2013.01.01,1901.01.01","34,13",2190,"opportunistic","anthropogenic","habitat_loss","invasive_species","disease","chronic","microsat","skin","dried","phenol-chloroform","Cycle","PCR","coot; 2013 represents 2012-2013, 1901 represents 1835-1939 (not perfect midpoint, but most samples from 1895 & 1907 and 1901 is midpoint for those years)","2013.01.01","34","13",NA,NA,NA,NA,NA,NA,NA,NA,NA,NA,NA,NA,NA,NA,NA,NA,NA,NA,NA,NA,NA,NA,NA,NA,NA,NA,NA,NA,NA,NA,NA,NA,NA,NA,NA,NA,NA,NA,NA,NA,NA,NA,NA,NA,NA,NA,NA,NA,NA,NA,NA,NA,NA,NA,NA,NA,NA,NA,NA,NA,NA,"USA",NA,NA,NA,NA,NA,NA,NA,NA,NA,NA,NA,NA,NA,NA,NA,NA,NA,NA,NA,NA,NA,NA,NA,NA,NA,NA,NA,NA,NA,NA,NA,NA,NA,NA,NA,NA,NA,NA,NA,18.6794520547945,40908,112.076712328767
"142",168,3911,"","Genetic implications of bottleneck effects of differing severities on genetic diversity in naturally recovering populations: An example from Hawaiian coot and Hawaiian gallinule","Sonsthagen, SA; Wilson, RE; Underwood, JG","The evolutionary trajectory of populations through time is influenced by the interplay of forces (biological, evolutionary, and anthropogenic) acting on the standing genetic variation. We used microsatellite and mitochondrial loci to examine the influence of population declines, of varying severity, on genetic diversity within two Hawaiian endemic waterbirds, the Hawaiian coot and Hawaiian gallinule, by comparing historical (samples collected in the late 1800s and early 1900s) and modern (collected in 2012-2013) populations. Population declines simultaneously experienced by Hawaiian coots and Hawaiian gallinules differentially shaped the evolutionary trajectory of these two populations. Within Hawaiian coot, large reductions (between -38.4% and -51.4%) in mitochondrial diversity were observed, although minimal differences were observed in the distribution of allelic and haplotypic frequencies between sampled time periods. Conversely, for Hawaiian gallinule, allelic frequencies were strongly differentiated between time periods, signatures of a genetic bottleneck were detected, and biases in means of the effective population size were observed at microsatellite loci. The strength of the decline appears to have had a greater influence on genetic diversity within Hawaiian gallinule than Hawaiian coot, coincident with the reduction in census size. These species exhibit similar life history characteristics and generation times; therefore, we hypothesize that differences in behavior and colonization history are likely playing a large role in how allelic and haplotypic frequencies are being shaped through time. Furthermore, differences in patterns of genetic diversity within Hawaiian coot and Hawaiian gallinule highlight the influence of demographic and evolutionary processes in shaping how species respond genetically to ecological stressors.","ssonsthagen@usgs.gov",2017,"10.1002/ece3.3530","ECOLOGY AND EVOLUTION","historical-dna","EG","RC","accept","accept","empirical","diversity","popsize","","","","other","Aves","USA","Oahu","2013.01.01,1915.01.01","29,23",2555,"opportunistic","anthropogenic","habitat_loss","invasive_species","disease","chronic","microsat","skin","dried","phenol-chloroform","Cycle","PCR","gallinule; 2013 represents 2012-2013, 1915 represents 1893-1938","2013.01.01","29","23",NA,NA,NA,NA,NA,NA,NA,NA,NA,NA,NA,NA,NA,NA,NA,NA,NA,NA,NA,NA,NA,NA,NA,NA,NA,NA,NA,NA,NA,NA,NA,NA,NA,NA,NA,NA,NA,NA,NA,NA,NA,NA,NA,NA,NA,NA,NA,NA,NA,NA,NA,NA,NA,NA,NA,NA,NA,NA,NA,NA,NA,"USA",NA,NA,NA,NA,NA,NA,NA,NA,NA,NA,NA,NA,NA,NA,NA,NA,NA,NA,NA,NA,NA,NA,NA,NA,NA,NA,NA,NA,NA,NA,NA,NA,NA,NA,NA,NA,NA,NA,NA,14.0097847358121,35795,98.0684931506849
"143",170,4776," ","Historic and contemporary levels of genetic variation in two New Zealand passerines with different histories of decline","Taylor, SS; Jamieson, IG; Wallis, GP","We compared historic and contemporary genetic variation in two threatened New Zealand birds (saddlebacks and robins) with disparate bottleneck histories. Saddlebacks showed massive loss of genetic variation when extirpated from the mainland, but no significant loss of variation following a severe bottleneck in the 1960s when the last population was reduced from similar to 1000 to 36 birds. Low genetic variation was probably characteristic of this isolated island population: considerably more genetic variation would exist in saddlebacks today if a mainland population had survived. In contrast to saddlebacks, contemporary robin populations showed only a small decrease in genetic variation compared with historical populations. Genetic variation in robins was probably maintained because of their superior ability to disperse and coexist with introduced predators. These results demonstrate that contemporary genetic variation may depend more greatly on the nature of the source population and its genetic past than it does on recent bottlenecks.","ian.jamieson@stonebow.otago.ac.nz",2007,"10.1111/j.1420-9101.2007.01362.x","JOURNAL OF EVOLUTIONARY BIOLOGY","ancient-dna","JW","RC","accept","accept","empirical","diversity","popsize","connectivity"," ","","terrestrial","Aves","NewZealand","Big Island.Kaimohu Island,Big South Cape Island,Mainland","2005.01.01,1948.01.01,1888.01.01","35.16,20,24",2920,"opportunistic","anthropogenic","invasive_species"," "," ","acute","microsat","skin","dried","Qiagen","Sanger","PCR","Saddlebacks; 1948 represents 1931-1965, 1888 represents 1877-1898","2005.01.01","35.16","20","24",NA,NA,NA,NA,NA,NA,NA,NA,NA,NA,NA,NA,NA,NA,NA,NA,NA,NA,NA,NA,NA,NA,NA,NA,NA,NA,NA,NA,NA,NA,NA,NA,NA,NA,NA,NA,NA,NA,NA,NA,NA,NA,NA,NA,NA,NA,NA,NA,NA,NA,NA,NA,NA,NA,NA,NA,NA,NA,NA,NA,"NewZealand",NA,NA,NA,NA,NA,NA,NA,NA,NA,NA,NA,NA,NA,NA,NA,NA,NA,NA,NA,NA,NA,NA,NA,NA,NA,NA,NA,NA,NA,NA,NA,NA,NA,NA,NA,NA,NA,NA,NA,14.6349315068493,42734,117.079452054795
"144",171,4776," ","Historic and contemporary levels of genetic variation in two New Zealand passerines with different histories of decline","Taylor, SS; Jamieson, IG; Wallis, GP","We compared historic and contemporary genetic variation in two threatened New Zealand birds (saddlebacks and robins) with disparate bottleneck histories. Saddlebacks showed massive loss of genetic variation when extirpated from the mainland, but no significant loss of variation following a severe bottleneck in the 1960s when the last population was reduced from similar to 1000 to 36 birds. Low genetic variation was probably characteristic of this isolated island population: considerably more genetic variation would exist in saddlebacks today if a mainland population had survived. In contrast to saddlebacks, contemporary robin populations showed only a small decrease in genetic variation compared with historical populations. Genetic variation in robins was probably maintained because of their superior ability to disperse and coexist with introduced predators. These results demonstrate that contemporary genetic variation may depend more greatly on the nature of the source population and its genetic past than it does on recent bottlenecks.","ian.jamieson@stonebow.otago.ac.nz",2007,"10.1111/j.1420-9101.2007.01362.x","JOURNAL OF EVOLUTIONARY BIOLOGY","ancient-dna","JW","RC","accept","accept","empirical","diversity","popsize","connectivity"," ","","terrestrial","Aves","NewZealand","Mainland.Offshore Islands","2003.01.01,1914.01.01","203.80,32.8",2190,"opportunistic","anthropogenic","habitat_loss","invasive_species","","acute","microsat","skin","dried","Qiagen","Sanger","PCR","Robins; generation time from: http://datazone.birdlife.org/species/factsheet/south-island-robin-petroica-australis/details; 2003 represents 2000-2005, 1914 represents 1873-1955","2003.01.01","203.80","32.8",NA,NA,NA,NA,NA,NA,NA,NA,NA,NA,NA,NA,NA,NA,NA,NA,NA,NA,NA,NA,NA,NA,NA,NA,NA,NA,NA,NA,NA,NA,NA,NA,NA,NA,NA,NA,NA,NA,NA,NA,NA,NA,NA,NA,NA,NA,NA,NA,NA,NA,NA,NA,NA,NA,NA,NA,NA,NA,NA,NA,NA,"NewZealand",NA,NA,NA,NA,NA,NA,NA,NA,NA,NA,NA,NA,NA,NA,NA,NA,NA,NA,NA,NA,NA,NA,NA,NA,NA,NA,NA,NA,NA,NA,NA,NA,NA,NA,NA,NA,NA,NA,NA,14.8433789954338,32507,89.0602739726027
"145",172,9871,"","A study of genetic variations, population size, and population dynamics of the catadromous Japanese eel Anguilla japonica (Pisces) in northern Taiwan","Tseng, MC; Kao, HW; Hung, YH; Lee, TL","Japanese eels are widely distributed in northeast Asian countries, and they have a catadromous life history. In this article, we explored whether Japanese elvers have temporal genetic structure and whether the population went through population expansion during the Pleistocene. In total, 273 specimens were collected from the Tanshui River estuary, northern Taiwan, in 1989-2008. The highly variable region of the mitochondrial DNA D-loop was cloned and sequenced. A genealogy was reconstructed based on the Neighbor-joining method, and results showed an unobvious yearly clade and a high level of haplotype diversity, but low mean nucleotide diversity among samples. Most of the pairwise F (ST) appeared statistically insignificant. These genetic parameters suggested a lack of temporal population structure combined with a sustainable high effective population size of Japanese eels. Negative values of Tajima's D and Fu's F (s) appeared in all samples with high significance. The mismatch distribution, skyline plot, and minimum spanning network indicated that historical population expansion of the Japanese eel could be traced back to the Pleistocene. Results of this study imply the Japanese eel has a complex life history, and the temporal structure of Japanese eels should be continually monitored in the future.","mctseng@mail.npust.edu.tw",2012,"10.1007/s10750-011-0958-z","HYDROBIOLOGIA","historical-dna","AAS","RC","accept","accept","empirical","diversity","popsize","","","","other","Actinopterygii","Taiwan","Tanshui River","2008.01.01,2007.01.01,2005.01.01,2003.01.01,2000.01.01,1995.01.01,1991.02.01,1990.12.01,1989.01.01","31,32,30,30,32,29,28,30,31",2372,"pre-designed","both","human_exploitation","env_variation","climate_change","chronic","mtDNA_seq","muscle","ethanol","PUREGENE DNA purification kit","Sanger","PCR","","2008.01.01","31","32","30","30","32","29","28","30","31",NA,NA,NA,NA,NA,NA,NA,NA,NA,NA,NA,NA,NA,NA,NA,NA,NA,NA,NA,NA,NA,NA,NA,NA,NA,NA,NA,NA,NA,NA,NA,NA,NA,NA,NA,NA,NA,NA,NA,NA,NA,NA,NA,NA,NA,NA,NA,NA,NA,NA,NA,NA,NA,NA,"Taiwan",NA,NA,NA,NA,NA,NA,NA,NA,NA,NA,NA,NA,NA,NA,NA,NA,NA,NA,NA,NA,NA,NA,NA,NA,NA,NA,NA,NA,NA,NA,NA,NA,NA,NA,NA,NA,NA,NA,NA,2.92537942664418,6939,19.0109589041096
