"50",57,7411,NA,"Estimating the contribution of Greenland Halibut (Reinhardtius hippoglossoides) stocks to nurseries by means of genotyping-bysequencing: Sex and time matter","Carrier, E; Ferchaud, AL; Normandeau, E; Sirois, P; Bernatchez, L","Identification of stocks and quantification of their relative contribution to recruitment are major objectives toward improving the management and conservation of marine exploited species. Next-generation sequencing allows for thousands of genomic markers to be analyzed, which provides the resolution needed to address these questions in marine species with weakly differentiated populations. Greenland Halibut (Reinhardtius hippoglossoides) is one of the most important exploited demersal species throughout the North Atlantic, in particular in the Gulf of St. Lawrence, Canada. There, two nurseries are known, the St. Lawrence Estuary and the northern Anticosti Island, but their contribution to the renewal of stocks remains unknown. The goals of this study were (a) to document the genetic structure and (b) to estimate the contribution of the different identified breeding stocks to nurseries. We sampled 100 juveniles per nursery and 50 adults from seven sites ranging from Saguenay Fjord to offshore Newfoundland, with some sites sampled over two consecutive years in order to evaluate the temporal stability of the contribution. Our results show that after removing sex-linked markers, the Estuary/Gulf of St. Lawrence represents a single stock which is genetically distinct from the Atlantic around Newfoundland (F-ST = 0.00146, p-value = .001). Population assignment showed that recruitment in both nurseries is predominantly associated with the St. Lawrence stock. However, we found that the relative contribution of both stocks to the nurseries is temporally variable with 1% contribution of the Newfoundland stock one year but up to 33% for the second year, which may be caused by year-to-year variation in larval transport into the Gulf of St. Lawrence. This study serves as a model for the identification of stocks for fisheries resources in a context where few barriers to dispersal occur, in addition to demonstrating the importance of considering sex-linked markers and temporal replicates in studies of population genomics.","emilie.carrier.10@ulaval.ca",2020,"10.1111/eva.12979","EVOLUTIONARY APPLICATIONS","temporal-genomics","BR","AAS","accept","accept","empirical","connectivity","","","","","marine","Actinopterygii","Canada","ESTJ.ANTJ.SAGU.ESTU.GASP.NANT.ESQU.NFLD.NFLG,ESTJ.ANTJ.SAGU.ESTU.GASP.NANT.ESQU.NFLD.NFLG,","2016.01.01,2017.01.01","100.100.50.50.50.50.50.50.50,100.100.50.50.50.50.50.50.50",4034.5,"pre-designed","","","","","","SNP","fin","ethanol","Aljanabi & Martinez 1997","Ion_Torrent","RAD","No driver process; Generation time (Age at 50% maturity): Morgan and Bowering 2000","2016.01.01","100.100.50.50.50.50.50.50.50","100.100.50.50.50.50.50.50.50",NA,NA,NA,NA,NA,NA,NA,NA,NA,NA,NA,NA,NA,NA,NA,NA,NA,NA,NA,NA,NA,NA,NA,NA,NA,NA,NA,NA,NA,NA,NA,NA,NA,NA,NA,NA,NA,NA,NA,NA,NA,NA,NA,NA,NA,NA,NA,NA,NA,NA,NA,NA,NA,NA,NA,NA,NA,NA,NA,NA,NA,"Canada",NA,NA,NA,NA,NA,NA,NA,NA,NA,NA,NA,NA,NA,NA,NA,NA,NA,NA,NA,NA,NA,NA,NA,NA,NA,NA,NA,NA,NA,NA,NA,NA,NA,NA,NA,NA,NA,NA,NA,0.0907175610360639,366,1.0027397260274
"51",58,3704,NA,"Temporal variation in spatial genetic structure during population outbreaks: Distinguishing among different potential drivers of spatial synchrony","Larroque, J; Legault, S; Johns, R; Lumley, L; Cusson, M; Renaut, S; Levesque, RC; James, PMA","Spatial synchrony is a common characteristic of spatio-temporal population dynamics across many taxa. While it is known that both dispersal and spatially autocorrelated environmental variation (i.e., the Moran effect) can synchronize populations, the relative contributions of each, and how they interact, are generally unknown. Distinguishing these mechanisms and their effects on synchrony can help us to better understand spatial population dynamics, design conservation and management strategies, and predict climate change impacts. Population genetic data can be used to tease apart these two processes as the spatio-temporal genetic patterns they create are expected to be different. A challenge, however, is that genetic data are often collected at a single point in time, which may introduce context-specific bias. Spatio-temporal sampling strategies can be used to reduce bias and to improve our characterization of the drivers of spatial synchrony. Using spatio-temporal analyses of genotypic data, our objective was to identify the relative support for these two mechanisms to the spatial synchrony in population dynamics of the irruptive forest insect pest, the spruce budworm (Choristoneura fumiferana), in Quebec (Canada). AMOVA, cluster analysis, isolation by distance, and sPCA were used to characterize spatio-temporal genomic variation using 1,370 SBW larvae sampled over four years (2012-2015) and genotyped at 3,562 SNP loci. We found evidence of overall weak spatial genetic structure that decreased from 2012 to 2015 and a genetic diversity homogenization among the sites. We also found genetic evidence of a long-distance dispersal event over >140 km. These results indicate that dispersal is the key mechanism involved in driving population synchrony of the outbreak. Early intervention management strategies that aim to control source populations have the potential to be effective through limiting dispersal. However, the timing of such interventions relative to outbreak progression is likely to influence their probability of success.","larroque.jeremy@gmail.com",2019,"10.1111/eva.12852","EVOLUTIONARY APPLICATIONS","temporal-genetics","EG","AAS","accept","accept","empirical","connectivity","","","","","terrestrial","Insecta","Canada","site1.site2.site3.site4.site5.site6.site7.site8.site9.site10.site11.site12.site13.site14.site15.site16.site17.site18.site19.site20.site21.site22.site23.site24.site25.site26.site27.site28.site29.site30,site10.site11.site13.site16.site17.site18.site23.site27.site28.site29.site31.site32.site35.site36,site10.site11.site12.site13.site16.site18.site23.site24.site26.site27.site29.site31.site33.site35.site36.site37.site38,site11.site14.site18.site24.site29.site31.site33.site34.site35.site36","2012.06.01,2013.06.01,2014.06.01,2015.06.01","25.24.16.21.21.8.17.12.24.22.23.19.25.25.10.24.24.24.10.15.25.25.7.9.9,25.24.28.31.27.31.18.29.28.33.32.16.32.32,9.16.15.12.15.17.11.14.12.12.12.10.14.14.15.15.10,19.14.19.19.15.15.13.14.12",365,"opportunistic","natural","env_variation","invasive_species","","chronic","SNP","body","frozen","Qiagen DNA Blood and Tissue Kit","Illumina_HiSeq","RAD","Generation time: Royama 1984","2012.06.01","25.24.16.21.21.8.17.12.24.22.23.19.25.25.10.24.24.24.10.15.25.25.7.9.9","25.24.28.31.27.31.18.29.28.33.32.16.32.32","9.16.15.12.15.17.11.14.12.12.12.10.14.14.15.15.10","19.14.19.19.15.15.13.14.12",NA,NA,NA,NA,NA,NA,NA,NA,NA,NA,NA,NA,NA,NA,NA,NA,NA,NA,NA,NA,NA,NA,NA,NA,NA,NA,NA,NA,NA,NA,NA,NA,NA,NA,NA,NA,NA,NA,NA,NA,NA,NA,NA,NA,NA,NA,NA,NA,NA,NA,NA,NA,NA,NA,NA,NA,NA,NA,NA,"Canada",NA,NA,NA,NA,NA,NA,NA,NA,NA,NA,NA,NA,NA,NA,NA,NA,NA,NA,NA,NA,NA,NA,NA,NA,NA,NA,NA,NA,NA,NA,NA,NA,NA,NA,NA,NA,NA,NA,NA,3,1095,3
"52",59,9581,NA,"Inferring dispersal across a fragmented landscape using reconstructed families in the Glanville fritillary butterfly","Fountain, T; Husby, A; Nonaka, E; Dileo, MF; Korhonen, JH; Rastas, P; Schulz, T; Saastamoinen, M; Hanski, I","Dispersal is important for determining both species ecological processes, such as population viability, and its evolutionary processes, like gene flow and local adaptation. Yet obtaining accurate estimates in the wild through direct observation can be challenging or even impossible, particularly over large spatial and temporal scales. Genotyping many individuals from wild populations can provide detailed inferences about dispersal. We therefore utilized genomewide marker data to estimate dispersal in the classic metapopulation of the Glanville fritillary butterfly (Melitaea cinxia L.), in the Aland Islands in SW Finland. This is an ideal system to test the effectiveness of this approach due to the wealth of information already available covering dispersal across small spatial and temporal scales, but lack of information at larger spatial and temporal scales. We sampled three larvae per larval family group from 3732 groups over a six-year period and genotyped for 272 SNPs across the genome. We used this empirical data set to reconstruct cases where full-sibs were detected in different local populations to infer female effective dispersal distance, that is, dispersal events directly contributing to gene flow. On average this was one kilometre, closely matching previous dispersal estimates made using direct observation. To evaluate our power to detect full-sib families, we performed forward simulations using an individual-based model constructed and parameterized for the Glanville fritillary metapopulation. Using these simulations, 100% of predicted full-sibs were correct and over 98% of all true full-sib pairs were detected. We therefore demonstrate that even in a highly dynamic system with a relatively small number of markers, we can accurately reconstruct full-sib families and for the first time make inferences on female effective dispersal. This highlights the utility of this approach in systems where it has previously been impossible to obtain accurate estimates of dispersal over both ecological and evolutionary scales.","toby.fountain@ebc.uu.se",2018,"10.1111/eva.12552","EVOLUTIONARY APPLICATIONS","temporal-genetics","EG","AAS","accept","accept","empirical","connectivity","","","","","terrestrial","Insecta","Finland","Sottunga.Foglo.Saltvik,Sottunga.Foglo.Saltvik,Sottunga.Foglo.Saltvik,Sottunga.Foglo.Saltvik,Sottunga.Foglo.Saltvik,Sottunga.Foglo.Saltvik","2007.01.01,2008.01.01,2009.01.01,2010.01.01,2011.01.01,2012.01.01","114.259.495,37.80.187,49.63.835,21.22.456,34.99.2017,69.285.3200",365,"pre-designed","natural","","","",NA,"SNP","body",NA,"NucleoSpin 96 Tissue Core Kit (Macherey-Nagel)","KASP platform","RNA","Generation time: Hanski et al., 2017; no real driver or sample storage","2007.01.01","114.259.495","37.80.187","49.63.835","21.22.456","34.99.2017","69.285.3200",NA,NA,NA,NA,NA,NA,NA,NA,NA,NA,NA,NA,NA,NA,NA,NA,NA,NA,NA,NA,NA,NA,NA,NA,NA,NA,NA,NA,NA,NA,NA,NA,NA,NA,NA,NA,NA,NA,NA,NA,NA,NA,NA,NA,NA,NA,NA,NA,NA,NA,NA,NA,NA,NA,NA,NA,NA,"Finland",NA,NA,NA,NA,NA,NA,NA,NA,NA,NA,NA,NA,NA,NA,NA,NA,NA,NA,NA,NA,NA,NA,NA,NA,NA,NA,NA,NA,NA,NA,NA,NA,NA,NA,NA,NA,NA,NA,NA,5.0027397260274,1826,5.0027397260274
"53",60,3449,NA,"Evolutionary mechanisms shaping the genetic population structure of marine fishes; lessons from the European flounder (Platichthys flesus L.)","Hemmer-Hansen, J; Nielsen, EE; Gronkjaer, P; Loeschcke, V","A number of evolutionary mechanisms have been suggested for generating low but significant genetic structuring among marine fish populations. We used nine microsatellite loci and recently developed methods in landscape genetics and coalescence-based estimation of historical gene flow and effective population sizes to assess temporal and spatial dynamics of the population structure in European flounder (Platichthys flesus L.). We collected 1062 flounders from 13 localities in the northeast Atlantic and Baltic Seas and found temporally stable and highly significant genetic differentiation among samples covering a large part of the species' range (global F-ST = 0.024, P < 0.0001). In addition to historical processes, a number of contemporary acting evolutionary mechanisms were associated with genetic structuring. Physical forces, such as oceanographic and bathymetric barriers, were most likely related with the extreme isolation of the island population at the Faroe Islands. A sharp genetic break was associated with a change in life history from pelagic to benthic spawners in the Baltic Sea. Partial Mantel tests showed that geographical distance per se was not related with genetic structuring among Atlantic and western Baltic Sea samples. Alternative factors, such as dispersal potential and/or environmental gradients, could be important for generating genetic divergence in this region. The results show that the magnitude and scale of structuring generated by a specific mechanism depend critically on its interplay with other evolutionary mechanisms, highlighting the importance of investigating species with wide geographical and ecological distributions to increase our understanding of evolution in the marine environment.","jhh@difres.dk",2007,"10.1111/j.1365-294X.2007.03367.x","MOLECULAR ECOLOGY","temporal-genetics","RC","KC","accept","accept","empirical","connectivity","diversity","","","","marine","Actinopterygii","Finland,Sweden,Denmark,UK,Netherlands,France,Norway","Turku,Turku,Gotland,Gotland,Bornholm,Bornholm,Ærø, Ærø ,Thyborøn,Thyborøn,Ringkøbing Fjord,Ringkøbing Fjord,The Limfjord,Irish Sea,Irish Sea,Westerschelde Estuary,Bay of Biscay,Bay of Biscay,Trondheim,Lake Pulmanki,Faeroe Islands,Faeroe Islands,Plaice","2003.01.01,2004.01.01,2003.01.01,2004.01.01,2003.01.01,2004.01.01,2003.01.01,2004.01.01,2003.01.01,2004.01.01,2003.01.01,2004.01.01,2003.01.01,2003.01.01,2004.01.01,2003.01.01,2003.01.01,2004.01.01,2004.01.01,2004.01.01,2003.01.01,2004.01.01,2003.01.01","54,50,46,48,55,53,52,52,55,59,39,50,55,49,49,47,49,39,49,34,44,34,18",NA,"opportunistic","natural","","","","chronic","microsat",NA,NA,"HotSHOT, Chelex, DNEasy","Pharmacia ALFexpress","PCR","","2003.01.01","54","50","46","48","55","53","52","52","55","59","39","50","55","49",49,47,"49","39","49",34,44,"34","18",NA,NA,NA,NA,NA,NA,NA,NA,NA,NA,NA,NA,NA,NA,NA,NA,NA,NA,NA,NA,NA,NA,NA,NA,NA,NA,NA,NA,NA,NA,NA,NA,NA,NA,NA,NA,NA,NA,NA,NA,"Finland","Sweden","Denmark","UK","Netherlands","France","Norway",NA,NA,NA,NA,NA,NA,NA,NA,NA,NA,NA,NA,NA,NA,NA,NA,NA,NA,NA,NA,NA,NA,NA,NA,NA,NA,NA,NA,NA,NA,NA,NA,NA,NA,365,1
"54",61,3452,NA,"Genetic analysis reveals temporal population structure in Caribbean spiny lobster (Panulirus argus) within marine protected areas in Mexico","Truelove, NK; Ley-Cooper, K; Segura-Garcia, I; Briones-Fourzan, P; Lozano-Alvarez, E; Phillips, BF; Box, SJ; Preziosi, RF","Management efforts for improving the sustainability of the Caribbean spiny lobster (Panulirus argus) fishery require knowledge of population connectivity. The aim of this study is to investigate population connectivity of P. argus at two levels: (1) spatially between two marine protected areas (MPAs) in the Caribbean coast of Mexico, and (2) temporally within MPAs; by genotyping discrete size classes lobsters using microsatellite markers. No evidence of population differentiation between lobster populations from Banco Chinchorro and Sian Ka'an MPAs was found (P= 0.139). In contrast significant levels of population differentiation among discrete size classes of lobsters was found (F-ST = 0.0054; P=0.0052). Temporal variation among the genotypes of new larval recruits may explain these results. Future research will be required to directly test the genotypes of new larval recruits in Banco Chinchorro and Sian Ka'an MPAs to confirm this hypothesis. (C) 2015 Elsevier B.V. All rights reserved.","trueloven@gmail.com",2015,"10.1016/j.fishres.2015.05.029","FISHERIES RESEARCH","historical-dna","EG","KC","accept","accept","empirical","connectivity","diversity","","","","marine","Malacostraca","Mexico","Sian Ka’an Biosphere Reserve,Banco Chinchorro Biosphere Reserve","2011.08.24,2011.08.24","62,78",NA,"pre-designed","natural","","","","chronic","microsat","leg","ethanol","Wizard SV-96 Genomic DNA extraction kit","Sanger","PCR","Reveiw. Does not mention any marker but it might have sequence data. Maybe a good comparison for phenotypic change through time. KC- review as a future directions idea- they didn't sample at different periods of time but instead used body size as a proxy for age/time","2011.08.24","62","78",NA,NA,NA,NA,NA,NA,NA,NA,NA,NA,NA,NA,NA,NA,NA,NA,NA,NA,NA,NA,NA,NA,NA,NA,NA,NA,NA,NA,NA,NA,NA,NA,NA,NA,NA,NA,NA,NA,NA,NA,NA,NA,NA,NA,NA,NA,NA,NA,NA,NA,NA,NA,NA,NA,NA,NA,NA,NA,NA,NA,NA,"Mexico",NA,NA,NA,NA,NA,NA,NA,NA,NA,NA,NA,NA,NA,NA,NA,NA,NA,NA,NA,NA,NA,NA,NA,NA,NA,NA,NA,NA,NA,NA,NA,NA,NA,NA,NA,NA,NA,NA,NA,NA,0,0
"55",62,5882,NA,"Admixture of two phylogeographic lineages of the Eurasian beaver in Poland","Biedrzycka, A; Konior, M; Babik, W; Swislocka, M; Ratkiewicz, M","The Eurasian beaver (Castor fiber) represents an uncommon example of an endangered species in which the restoration programs proved a spectacular success and led to enormous spatial and demographic expansion. Documented reintroduction of beavers in Poland has been conducted using animals of the eastern European origin, most likely derived from the eastern mtDNA lineage. However demographic and spatial expansion of beavers from Germany, which represent the western lineage, may have led to admixture of these two genetically distinct entities in Poland. We detected significant genetic differentiation between the populations from W and NE Poland both in mitochondrial DNA control region and microsatellites, but also substantial admixture including apparent first-generation migrants between regions. Our results indicate that beavers from the western mtDNA lineage have contributed considerably to the Polish population, particularly in W Poland. As there have been no adequately documented translocations of beavers from the western European populations to Poland, the observed situation appears to result from natural migration or range expansion from the west. In contrast to previous findings we detected a substantial diversity in mtDNA control region, which indicates that either the variation in relict populations has been underestimated, or that additional relict beaver populations survived at the end of the 19th century in Poland and Germany as indicated by considerable similarity of ancient and extant mtDNA haplotypes. The implications of our findings for beaver conservation and management are discussed. (C) 2014 Deutsche Gesellschaft fur Saugetierkunde. Published by Elsevier GmbH. All rights reserved.","biedrzycka@iop.krakow.pl",2014,"10.1016/j.mambio.2014.04.005","MAMMALIAN BIOLOGY","ancient-dna","EG","KC","accept","accept","empirical","connectivity","diversity","","","","freshwater","Mammalia","Poland",NA,NA,NA,NA,"pre-designed","anthropogenic","human_exploitation","","","chronic","mtDNA_seq","skin.tissue","ethanol, dried","NucleoSpin Tissue Kit (Macherey and Nagel","Sanger","PCR","total number of samples for each time point and location not given",NA,NA,NA,NA,NA,NA,NA,NA,NA,NA,NA,NA,NA,NA,NA,NA,NA,NA,NA,NA,NA,NA,NA,NA,NA,NA,NA,NA,NA,NA,NA,NA,NA,NA,NA,NA,NA,NA,NA,NA,NA,NA,NA,NA,NA,NA,NA,NA,NA,NA,NA,NA,NA,NA,NA,NA,NA,NA,NA,NA,NA,NA,NA,NA,"Poland",NA,NA,NA,NA,NA,NA,NA,NA,NA,NA,NA,NA,NA,NA,NA,NA,NA,NA,NA,NA,NA,NA,NA,NA,NA,NA,NA,NA,NA,NA,NA,NA,NA,NA,NA,NA,NA,NA,NA,NA,NA,NA
"56",64,6608,NA,"Spatio-temporal Genetic Structure of a Tropical Bee Species Suggests High Dispersal Over a Fragmented Landscape","Suni, SS; Bronstein, JL; Brosi, BJ","Habitat destruction threatens biodiversity by reducing the amount of available resources and connectivity among geographic areas. For organisms living in fragmented habitats, population persistence may depend on dispersal, which maintains gene flow among fragments and can prevent inbreeding within them. It is centrally important to understand patterns of dispersal for bees living in fragmented areas given the importance of pollination systems and recently documented declines in bee populations. We used population and landscape genetic techniques to characterize patterns of dispersal over a large fragmented area in southern Costa Rica for the orchid bee species Euglossa championi. First, we estimated levels of genetic differentiation among forest fragments as (PT), an analog to the traditional summary statistic F-ST, as well as two statistics that may more adequately represent levels of differentiation, G'(ST) and D-est. Second, we used a Bayesian approach to determine the number and composition of genetic groups in our sample. Third we investigated how genetic differentiation changes with distance. Fourth, we determined the extent to which deforested areas restrict dispersal. Finally, we estimated the extent to which there were temporal differences in allele frequencies within the same forest fragments. Within years we found low levels of differentiation even over 80km, and no effect of land use type on level of genetic differentiation. However, we found significant genetic differentiation between years. Taken together our results suggest that there are high levels of gene flow over this geographic area, and that individuals show low site fidelity over time.","sssuni@eco.umass.edu",2014,"10.1111/btp.12084","BIOTROPICA","temporal-genetics","RC","KC","accept","accept","empirical","connectivity","diversity","","","","terrestrial","Insecta","CostaRica","Las Alturas,LC Station,Romero II,Osa,Las Alturas,LC Station,Romero II","2009,2009,2009,2010,2010,2010,2010","11,25,19,59,17,8,12",61,"pre-designed","anthropogenic","habitat_loss","","","chronic","microsat","","","phenol-chloroform","Sanger","PCR","would qualify but uses microsats, generation time from  https://doi.org/10.1111/csp2.543","2009","11","25","19","59","17","8","12",NA,NA,NA,NA,NA,NA,NA,NA,NA,NA,NA,NA,NA,NA,NA,NA,NA,NA,NA,NA,NA,NA,NA,NA,NA,NA,NA,NA,NA,NA,NA,NA,NA,NA,NA,NA,NA,NA,NA,NA,NA,NA,NA,NA,NA,NA,NA,NA,NA,NA,NA,NA,NA,NA,NA,NA,"CostaRica",NA,NA,NA,NA,NA,NA,NA,NA,NA,NA,NA,NA,NA,NA,NA,NA,NA,NA,NA,NA,NA,NA,NA,NA,NA,NA,NA,NA,NA,NA,NA,NA,NA,NA,NA,NA,NA,NA,NA,NA,NA,NA
"57",65,11000,NA,"The Genetic Signature of Range Expansion in a Disease Vector-The Black-Legged Tick","Leo, SST; Gonzalez, A; Millien, V","Monitoring and predicting the spread of emerging infectious diseases requires that we understand the mechanisms of range expansion by its vectors. Here, we examined spatial and temporal variation of genetic structure among 13 populations of the Lyme disease vector, the black-legged tick, in southern Quebec, where this tick species is currently expanding and Lyme disease is emerging. Our objective was to identify the primary mode of tick movement into Canada based on observed spatial and temporal genetic patterns. Upon genotyping 10 microsatellite loci from 613 tick specimens, we found multiple genetic signatures of frequent long-distance dispersal events, supporting the hypothesis that migratory birds are the primary carriers of black-legged ticks into southern Quebec. When we compared results from analyses of pairwise differences among ticks collected from 8 different sites at different years between 2011 and 2014, we found that genetic variation observed among tick individuals appeared to be better explained by collection year than sampling locality. This suggests that while cohorts of black-legged ticks can rapidly invade large areas across southern Quebec, they also appear to be undergoing frequent turnover. Finally, the amount of genetic variation in tick populations across our study area appeared to be related to their degree of establishment, with established populations displaying a lower amount of temporal genetic variation than adventitious ones. Given that Lyme disease infection risk in a region can be influenced by the relative presence of established and/or adventitious tick populations, our results are useful for understanding both the seasonality and spatial variation of Lyme disease.","sarah.leo@mail.mcgill.ca",2017,"10.1093/jhered/esw073","JOURNAL OF HEREDITY","temporal-genetics","RC","KC","accept","accept","empirical","connectivity","diversity","","","","terrestrial","Insecta","Canada","BMF,DV,HR,HV,LP,LS,MSB,NO,SdV,SE,SF,SJ,SV,BMF,DV,HR,HV,LP,LS,MSB,NO,SdV,SE,SF,SJ,SV,BMF,DV,HR,HV,LP,LS,MSB,NO,SdV,SE,SF,SJ,SV,BMF,DV,HR,HV,LP,LS,MSB,NO,SdV,SE,SF,SJ,SV","2011,2011,2011,2011,2011,2011,2011,2011,2011,2011,2011,2011,2011,2012,2012,2012,2012,2012,2012,2012,2012,2012,2012,2012,2012,2012,2013,2013,2013,2013,2013,2013,2013,2013,2013,2013,2013,2013,2013,2014,2014,2014,2014,2014,2014,2014,2014,2014,2014,2014,2014,2014","30,5,24,30,11,25,39,20,14,8,23,5,35,0,16,5,0,0,0,7,8,0,0,0,0,0,32,42,12,30,0,0,20,38,0,7,12,7,24,0,20,1,0,0,0,15,8,0,9,19,2,5",NA,"","natural","invasive_species","","","chronic","microsat","body","","phenol-chloroform","Sanger","PCR","","2011","30","5","24","30","11","25","39","20","14","8","23","5","35","0",16,5,"0","0","0",7,8,"0","0","0",0,"0","32","42","12",30,"0","0",20,38,0,7,12,7,"24",0,20,1,0,0,0,15,8,0,"9",19,2,"5",NA,NA,NA,NA,NA,NA,NA,NA,NA,NA,NA,"Canada",NA,NA,NA,NA,NA,NA,NA,NA,NA,NA,NA,NA,NA,NA,NA,NA,NA,NA,NA,NA,NA,NA,NA,NA,NA,NA,NA,NA,NA,NA,NA,NA,NA,NA,NA,NA,NA,NA,NA,NA,NA,NA
