Article_Number,Second_Filter_Flag,Article_Title,Authors,Abstract,Email_Addresses,Publication_Year,DOI,Source_Title,Keyword_Search,Reviewer,Recorder,Decision,Removal_Criteria,study_type,subject_1,subject_2,subject_3,subject_4,hybridization,system,tax_group,country_samp,loc_samp,year_samp,num_samp,gen_time,study_design,type_change,driver_process1,driver_process2,driver_process3,length_process,data_type,tissue_type,preserv_method,extract_method,seq_platform,lib_prep_method,notes,,,,,,,,,
10563,,Phylogeographical patterns and a cryptic species provide new insights into Western Indian Ocean giant clams phylogenetic relationships and colonization history,"Fauvelot, C; Zuccon, D; Borsa, P; Grulois, D; Magalon, H; Riquet, F; Andrefouet, S; Berumen, ML; Sinclair-Taylor, TH; Gelin, P; Behivoke, F; ter Poorten, JJ; Strong, EE; Bouchet, P","Aim The unique biodiversity in the Red Sea is the result of complex ecological and evolutionary processes driven by Pleistocene climatic change. Here we investigate the species diversity, phylogenetic relationships and phylogeographical patterns of giant clams in the Western Indian Ocean (WIO) and the Red Sea to explore scenarios of marine speciation in this under-studied region. Location Mozambique Channel, Madagascar, and the Mascarene Islands (WIO); the Farasan Islands (Red Sea). Taxon Giant clams of the genus Tridacna (Cardiidae: Tridacninae). Methods Giant clams were sampled as complete organisms or through underwater biopsies. Nuclear (28S) and mitochondrial (16S and COI) DNA sequences were subjected to Bayesian and maximum likelihood analyses to generate a phylogenetic hypothesis for all known species within the genus Tridacna. Bayesian inference with molecular and fossil calibration was used to infer their colonization history. Results From the 10 genetically distinct clades recovered from the analyses of 253 sequenced specimens, five distinct Tridacna lineages were sampled, three of which were endemics of the WIO and the Red Sea. Each lineage corresponded to a distinct species, except one grouping the two formerly known WIO endemics, T. lorenzi and T. rosewateri. This lineage clustered with two other well-supported lineages: the Red Sea endemic T. squamosina, and a previously unrecognized lineage, restricted to the WIO, for which we resurrect the long-forgotten name T. elongatissima Bianconi, 1856. For the two other species sampled (T. maxima and T. squamosa), contrasting phylogeographical patterns were observed. Main conclusions Our data confirm the validity of the species T. rosewateri, a WIO endemic genetically indistinguishable from T. lorenzi, which should be considered a junior synonym. The phylogenetic placement of the newly resurrected T. elongatissima provides insights into the probable origin of T. squamosina, which split from its sister species no later than 2 Ma, likely during Middle Pleistocene glacial periods. Two scenarios are discussed. Our results also suggest that T. maxima invaded the Red Sea more recently and that contemporary gene flow between Red Sea and WIO T. maxima is highly restricted. The deep Red Sea partition observed in T. squamosa suggests a much older divergence and raises the question of a possible cryptic lineage.",cecile.fauvelot@ird.fr,2020,10.1111/jbi.13797,JOURNAL OF BIOGEOGRAPHY,historical-dna,JW,RC,reject,non-temporal,,,,,,,,,,,,,,,,,,,,,,,,,,Includes connectivity but might focus too much on phylogenetics; RC: no temporal replicates,,,,,,,,,
10617,,Comparative phylogeography of invasive Rattus rattus and Rattus norvegicus in the US reveals distinct colonization histories and dispersal,"Lack, JB; Hamilton, MJ; Braun, JK; Mares, MA; Van den Bussche, RA","Invasive Rattus are arguably the most costly and destructive invasive species on the planet, but little is known concerning their invasion history and population structure in the U.S. We utilized both nuclear microsatellites and mitochondrial DNA sequences (mtDNA) to compare the colonization history, patterns of gene flow, and levels of genetic diversity of Rattus rattus and R. norvegicus in the U.S. Analyses of mtDNA suggest R. rattus is characterized by a single rapid expansion into the U.S. from one or two very closely related mtDNA lineages or geographic sources. For R. norvegicus, mtDNA analyses suggest at least four invasions distinct in space and/or time have occurred to establish its distribution in the U.S. Microsatellite analyses suggest for R. rattus that dispersal is characterized by an isolation-by-distance pattern, suggesting a relatively low frequency of long distance dispersal, and low levels of establishment for novel propagules. In contrast, microsatellite analyses of R. norvegicus suggest high frequencies of long distance dispersal and essentially panmixia among nearly all sampled populations, as well as a high frequency of novel propagules entering at the east and west coasts and assimilating into established populations. We discuss these results in the context of invasive Rattus management in the U.S. and their implications for invasive species in general, as well as the implications for managing the spread of rat-borne pathogens.",justin.lack@okstate.edu,2013,10.1007/s10530-012-0351-5,BIOLOGICAL INVASIONS,museum-dna,JW,RC,reject,non-temporal,,,,,,,,,,,,,,,,,,,,,,,,,,RC: uses museum samples but no temporal replicates,,,,,,,,,
6453,,"Evidence for contemporary and historical gene flow between guppy populations in different watersheds, with a test for associations with adaptive traits","Blondel, L; Baillie, L; Quinton, J; Alemu, JB; Paterson, I; Hendry, AP; Bentzen, P","In dendritic river systems, gene flow is expected to occur primarily within watersheds. Yet, rare cross-watershed transfers can also occur, whether mediated by (often historical) geological events or (often contemporary) human activities. We explored these events and their potential evolutionary consequences by analyzing patterns of neutral genetic variation (microsatellites) and adaptive phenotypic variation (male color) in wild guppies (Poecilia reticulata) distributed across two watersheds in northern Trinidad. We found the expected signatures of within-watershed gene flow; yet we also inferred at least two instances of cross-watershed gene flowone in the upstream reaches and one further downstream. The upstream cross-watershed event appears to be very recent (41 +/- 13years), suggesting dispersal via recent flooding or undocumented human-mediated transport. The downstream cross-watershed event appears to be considerably older (577 +/- 265years), suggesting a role for rare geological or climatological events. Alongside these strong signatures of both contemporary and historical gene flow, we found little evidence of impacts on presumably adaptive phenotypic differentiation, except perhaps in the one instance of very recent cross-watershed gene flow. Selection in this system seems to overpower gene flowat least on the spatiotemporal scales investigated here.",lea.blondel@mail.mcgill.ca,2019,10.1002/ece3.5033,ECOLOGY AND EVOLUTION,historical-dna,ACS,RC,accept,accept,empirical,connectivity,adaptation,diversity,,no,freshwater,Actinopterygii,Trinidad and Tobago,"P7,P18,M3,M4,M7,M9,M10,M16","01.01.2014,01.01.2013,01.01.2010,01.01.2008,01.01.2006,01.01.2003,01.01.2002","31,31.41,40.38.32.50.46,40.51.50,50,36.34,40.13.40.40.40.40.40.40",146,pre-designed,natural,env_variation,natural_disaster,,chronic,microsat,fin,ethanol,modified glassmilk protocol,"Sanger,Illumina_MiSeq",PCR,"microsatellite, allozyme and mitochondrial DNA datasets;all sites sampled 2002 & 2010 except: P18 (2008 not 2010), M7 (2008 not 2010), M9 (2013 not 2010), M10 (2003 in addition), M15 (2006 not 2010), M16 (2003, 2006, 208, 2013 in addition); recorded 10loci-20sites unless 42loci-12sites was only one available",,,,,,,,,
122,,Temporal recruitment patterns and gene flow in kelp rockfish (Sebastes atrovirens),"Gilbert-Horvath, EA; Larson, RJ; Garza, JC","Pelagic dispersal of marine organisms provides abundant opportunity for gene flow and presumably inhibits population genetic divergence. However, ephemeral, fine-scale, temporal and spatial genetic heterogeneity is frequently observed in settled propagules of marine species that otherwise exhibit broad-scale genetic homogeneity. A large variance in reproductive success is one explanation for this phenomenon. Here, genetic analyses of 16 microsatellite loci are used to examine temporal patterns of variation in young-of-year kelp rockfish (Sebastes atrovirens) recruiting to nearshore habitat in Monterey Bay, California, USA. Population structure of adults from central California is also evaluated to determine if spatial structure exists and might potentially contribute to recruitment patterns. Genetic homogeneity was found among 414 young-of-year sampled throughout the entire 1998 recruitment season. No substantial adult population structure was found among seven populations spanning 800 km of coastline that includes the Point Conception marine biogeographic boundary. Comparison of young-of-year and adult samples revealed no genetic differentiation and no measurable reduction in genetic variation of offspring, indicating little variance in reproductive success and no reduction in effective population size for this year class. Simulation analyses determined that the data set was sufficiently powerful to detect both slight population structure among adults and a small reduction in effective number of breeders contributing to this year class. The findings of high gene flow and low genetic drift have important implications for fisheries management and conservation efforts.",libby.gilbert@noaa.gov,2006,10.1111/j.1365-294X.2006.03033.x,MOLECULAR ECOLOGY,temporal-genetics,EG,RC,accept,accept,empirical,connectivity,popsize,diversity,,no,marine,Actinopterygii,USA,Otter Point,"09.24.1998,09.03.1998,08.06.1998,07.16.1998","60,41,62,127",1825,pre-designed,natural,env_variation,,,chronic,microsat,fin,frozen,NaCl/ethanol; DNeasy 96 Tissue kit,Sanger,PCR,"RC: only recording data for temporal replicate population, not parental pops; generation time estimated as age of first maturity from: https://sanctuarysimon.org/dbtools/species-database/id/208/sebastes/atrovirens/kelp-rockfish",,,,,,,,,
6419,,Temporally stable genetic variability and dynamic kinship structure in a fluctuating population of the root vole Microtus oeconomus,"Pilot, M; Dabrowski, MJ; Jancewicz, E; Schtickzelle, N; Gliwicz, J","Genetic variability, kin structure and demography of a population are mutually dependent. Population genetic theory predicts that under demographically stable conditions, neutral genetic variability reaches equilibrium between gene flow and drift. However, density fluctuations and non-random mating, resulting e.g. from kin clustering, may lead to changes in genetic composition over time. Theoretical models also predict that changes in kin structure may affect aggression level and recruitment, leading to density fluctuations. These predictions have been rarely tested in natural populations. The aim of this study was to analyse changes in genetic variability and kin structure in a local population of the root vole (Microtus oeconomus) that underwent a fourfold change in mean density over a 6-year period. Intensive live-trapping resulted in sampling 88% of individuals present in the study area, as estimated from mark-recapture data. Based on 642 individual genotypes at 20 microsatellite loci, we compared genetic variability and kin structure of this population between consecutive years. We found that immigration was negatively correlated with density, while the number of kin groups was positively correlated with density. This is consistent with theoretical predictions that changes in kin structure play an important role in population fluctuations. Despite the changes in density and kin structure, there was no genetic differentiation between years. Population-level genetic diversity measures did not significantly vary in time and remained relatively high (H-E range: 0.72-0.78). These results show that a population that undergoes significant demographic and social changes may maintain high genetic variability and stable genetic composition.",mpilot@miiz.waw.pl,2010,10.1111/j.1365-294X.2010.04692.x,MOLECULAR ECOLOGY,museum-dna,RC,RC,accept,accept,empirical,connectivity,diversity,popsize,,no,terrestrial,Mammalia,Poland,Narewka River Valley,"07.01.2005,07.01,2004,07.01.2003,07.01.2002,07.01.2001,07.01.2000","147,70,39,130,116,150",365,pre-designed,anthropogenic,climate_change,,,chronic,microsat,Toe pad,ethanol,Genomic Mini Kit,Sanger,PCR,,,,,,,,,,
2929,,Genetic and phenotypic characterization of a hybrid zone between polyandrous Northern and Wattled Jacanas in Western Panama,"Miller, MJ; Lipshutz, SE; Smith, NG; Bermingham, E","Background: Hybridization provides a unique perspective into the ecological, genetic and behavioral context of speciation. Hybridization is common in birds, but has not yet been reported among bird species with a simultaneously polyandrous mating system; a mating system where a single female defends a harem of males who provide nearly all parental care. Unlike simple polyandry, polyandrous mating is extremely rare in birds, with only 1% of bird species employing this mating system. Although it is classically held that females are """"choosy"""" in avian hybrid systems, nearly-exclusive male parental care raises the possibility that female selection against heterospecific matings might be reduced compared to birds with other mating systems. Results: We describe a narrow hybrid zone in southwestern Panama between two polyandrous freshwater waders: Northern Jacana, Jacana spinosa and Wattled Jacana, J. jacana. We document coincident cline centers for three phenotypic traits, mtDNA, and one of two autosomal introns. Cline widths for these six markers varied from seven to 142 km, with mtDNA being the narrowest, and five of the six markers having widths less than 100 km. Cline tails were asymmetrical, with greater introgression of J. jacana traits extending westward into the range of J. spinosa. Likewise, within the hybrid zone, the average hybrid index of phenotypic hybrids was significantly biased towards J. spinosa. Species distribution models indicate that the hybrid zone is located at the edge of a roughly 100 km wide overlap where habitat is predicted to be suitable for both species, with more westerly areas suitable only for spinosa and eastward habitats suitable only for J. jacana. Conclusion: The two species of New World jacanas maintain a narrow, and persistent hybrid zone in western Panama. The hybrid zone may be maintained by the behavioral dominance of J. spinosa counterbalanced by unsuitable habitat for J. spinosa east of the contact zone. Although the two parental species are relatively young, mitochondrial cline width was extremely narrow. This result suggests strong selection against maternally-inherited markers, which may indicate either mitonuclear incompatibilities and/or female choice against heterospecific matings typical of avian hybrid systems, despite jacana sex role reversal.",millerma@si.edu,2014,10.1186/s12862-014-0227-7,BMC EVOLUTIONARY BIOLOGY,museum-dna,BR,RC,reject,non-temporal,,,,,,,,,,,,,,,,,,,,,,,,,,RC: uses museum samples but no temporal replicates,,,,,,,,,
556,,Spatial genetic structure of the mountain pine beetle (Dendroctonus ponderosae) outbreak in western Canada: historical patterns and contemporary dispersal,"Samarasekera, GDNG; Bartell, NV; Lindgren, BS; Cooke, JEK; Davis, CS; James, PMA; Coltman, DW; Mock, KE; Murray, BW","Environmental change has a wide range of ecological consequences, including species extinction and range expansion. Many studies have shown that insect species respond rapidly to climatic change. A mountain pine beetle epidemic of record size in North America has led to unprecedented mortality of lodgepole pine, and a significant range expansion to the northeast of its historic range. Our goal was to determine the spatial genetic variation found among outbreak population from which genetic structure, and dispersal patterns may be inferred. Beetles from 49 sampling locations throughout the outbreak area in western Canada were analysed at 13 microsatellite loci. We found significant north-south population structure as evidenced by: (i) Bayesian-based analyses, (ii) north-south genetic relationships and diversity gradients; and (iii) a lack of isolation-by-distance in the northernmost cluster. The north-south structure is proposed to have arisen from the processes of postglacial colonization as well as recent climate-driven changes in population dynamics. Our data support the hypothesis of multiple sources of origin for the outbreak and point to the need for population specific information to improve our understanding and management of outbreaks. The recent range expansion across the Rocky Mountains into the jack/lodgepole hybrid and pure jack pine zones of northern Alberta is consistent with a northern British Columbia origin. We detected no loss of genetic variability in these populations, indicating that the evolutionary potential of mountain pine beetle to adapt has not been reduced by founder events. This study illustrates a rapid range-wide response to the removal of climatic constraints, and the potential for range expansion of a regional population.",murrayb@unbc.ca,2012,10.1111/j.1365-294X.2012.05587.x,MOLECULAR ECOLOGY,historical-dna,AAS,RC,reject,non-temporal,,,,,,,,,,,,,,,,,,,,,,,,,,RC: no temporal replicates,,,,,,,,,
1324,,Genetic structure of pike (Esox lucius) reveals a complex and previously unrecognized colonization history of Ireland,"Pedreschi, D; Kelly-Quinn, M; Caffrey, J; O'Grady, M; Mariani, S","AimWe investigated genetic variation of Irish pike populations and their relationship with European outgroups, in order to elucidate the origin of this species to the island, which is largely assumed to have occurred as a human-mediated introduction over the past few hundred years. We aimed thereby to provide new insights into population structure to improve fisheries and biodiversity management in Irish freshwaters. LocationIreland, Britain and continental Europe. MethodsA total of 752 pike (Esox lucius) were sampled from 15 locations around Ireland, and 9 continental European sites, and genotyped at six polymorphic microsatellite loci. Patterns and mechanisms of population genetic structure were assessed through a diverse array of methods, including Bayesian clustering, hierarchical analysis of molecular variance, and approximate Bayesian computation. ResultsVarying levels of genetic diversity and a high degree of population genetic differentiation were detected. Clear substructure within Ireland was identified, with two main groups being evident. One of the Irish populations showed high similarity with British populations. The other, more widespread, Irish strain did not group with any European population examined. Approximate Bayesian computation suggested that this widespread Irish strain is older, and may have colonized Ireland independently of humans. Main conclusionsPopulation genetic substructure in Irish pike is high and comparable to the levels observed elsewhere in Europe. A comparison of evolutionary scenarios upholds the possibility that pike may have colonized Ireland in two waves', the first of which, being independent of human colonization, would represent the first evidence for natural colonization of a non-anadromous freshwater fish to the island of Ireland. Although further investigations using comprehensive genomic techniques will be necessary to confirm this, the present results warrant a reappraisal of current management strategies for this species.",s.mariani@salford.ac.uk,2014,10.1111/jbi.12220,JOURNAL OF BIOGEOGRAPHY,historical-dna,KC,RC,reject,non-temporal,,,,,,,,,,,,,,,,,,,,,,,,,,RC: no temporal replicates,,,,,,,,,
1764,,"Range-wide fragmentation in a threatened fish associated with post-European settlement modification in the Murray-Darling Basin, Australia","Cole, TL; Hammer, MP; Unmack, PJ; Teske, PR; Brauer, CJ; Adams, M; Beheregaray, LB","Distinguishing the relative influence of historic (i.e. natural) versus anthropogenic factors in metapopulation structure is an important but often overlooked step in management programs of threatened species. Biotas in freshwater wetlands and floodplains, such as those in the Murray-Darling Basin (MDB)-one of Australia's most impacted ecosystems, are particularly susceptible to anthropogenic fragmentation. Here we present a comprehensive multilocus assessment of genetic variation in the threatened southern pygmy perch Nannoperca australis (578 individuals; 45 localities; microsatellite, allozyme and mitochondrial DNA datasets), an ecological specialist with low dispersal potential. We assess patterns of spatial structure and genetic diversity in populations spanning the highly fragmented MDB and test whether recent anthropogenic modification has disrupted range-wide connectivity. We detected strong and hierarchical population structure, very low genetic diversity and lack of contemporary gene flow across the MDB. In contrast, the apparent absence of pronounced or long-term phylogeographic structure suggests that observed population divergences generally do not reflect deeply historic natural fragmentation. Coalescent-based analyses supported this inference, revealing that divergence times between populations from the upper and lower MDB fall into the period of European settlement. It appears that the observed contemporary isolation of populations is partly explained by the severe modification of the MDB post-dating the onset of European settlement. Our integrated approach substantially improves the interpretation of how fragmentation impacts present-day biodiversity. It also provides novel contributions for risk-assessing management actions in the context of captive breeding and translocations of small freshwater fishes, a group of increasing global conservation concern.",Luciano.Beheregaray@flinders.edu.au,2016,10.1007/s10592-016-0868-8,CONSERVATION GENETICS,museum-dna,ACS,RC,reject,non-temporal,,,,,,,,,,,,,,,,,,,,,,,,,,RC: uses museum samples but no temporal replicates,,,,,,,,,
287,,Conflicting estimates of connectivity among deep-sea coral populations,"Miller, K; Williams, A; Rowden, AA; Knowles, C; Dunshea, G","Genetic data were used as an indirect means of assessing connectivity among deep-sea coral populations on seamounts and slopes in the Australian and New Zealand region. We sequenced three DNA regions (16S, ITS and Control Region) in nine deep-sea coral species from sites spanning thousands of kilometers. Based on haplotype distributions and AMOVA, we found evidence of genetic subdivision across ocean expanses for three species: the scleractinian Desmophyllum dianthus, and the antipatharians Antipathes robillardi and Stichopathes variabilis. Levels of genetic variation were low for the remaining species, including the reef-forming Solenosmila variablis and Madrepora oculata, and more sensitive molecular markers may be needed to resolve their spatial structure properly. For two species (the scleractinian Stephanocyathus spiniger and the antipatharian Stichopathes filiformis), we found no evidence of genetic subdivision among sites within regions, suggesting sufficient gene flow occurs to maintain genetic homogeneity at scales of tens to hundreds of kilometers. Recognising that some seamount regions and coral populations are, or are not, effectively isolated will be a key component of successful management planning based on marine protected area networks - both within and beyond national jurisdictions.",Karen.Miller@utas.edu.au,2010,10.1111/j.1439-0485.2010.00380.x,MARINE ECOLOGY-AN EVOLUTIONARY PERSPECTIVE,museum-dna,KJ,RC,reject,non-temporal,,,,,,,,,,,,,,,,,,,,,,,,,,microsats; RC: uses museum samples but no temporal replicates,,,,,,,,,
