Article_Number,Second_Filter_Flag,Article_Title,Authors,Abstract,Email_Addresses,Publication_Year,DOI,Source_Title,Keyword_Search,Reviewer,Recorder,Decision,Removal_Criteria,study_type,subject_1,subject_2,subject_3,subject_4,hybridization,system,tax_group,country_samp,loc_samp,year_samp,num_samp,gen_time,study_design,type_change,driver_process1,driver_process2,driver_process3,length_process,data_type,tissue_type,preserv_method,extract_method,seq_platform,lib_prep_method,notes,,,,,,,,,
6852,,Population fragmentation leads to spatial and temporal genetic structure in the endangered Spanish imperial eagle,"Martinez-Cruz, B; Godoy, JA; Negro, JJ","The fragmentation of a population may have important consequences for population genetic diversity and structure due to the effects of genetic drift and reduced gene flow. We studied the genetic consequences of the fragmentation of the Spanish imperial eagle (Aquila adalberti) population into small patches through a temporal analysis. Thirty-four museum individuals representing the population predating the fragmentation were analysed for a 345-bp segment of the mitochondrial control region and a set of 10 nuclear microsatellite loci. Data from a previous study on the current population (N = 79) were re-analysed for this subset of 10 microsatellite markers and results compared to those obtained from the historical sample. Three shared mitochondrial haplotypes were found in both populations, although fluctuations in haplotype frequencies and the occurrence of a fourth haplotype in the historical population resulted in lower current levels of haplotype and nucleotide diversity. However, microsatellite markers revealed undiminished levels of nuclear diversity. No evidence for genetic structure was observed for the historical Spanish imperial eagle population, suggesting that the current pattern of structure is the direct consequence of population fragmentation. Temporal fluctuations in mitochondrial and microsatellite allelic frequencies were found between the historical and the current population as well as for each pairwise comparison between historical and current Centro and historical and current Parque Nacional de Donana nuclei. Our results indicate an ancestral panmictic situation for the species that management policies should aim to restore. A historical analysis like the one taken here provides the baseline upon which the relative role of recent drift in shaping current genetic patterns in endangered species can be evaluated and this knowledge is used to guide conservation actions.",bemar@mnhn.fr,2007,10.1111/j.1365-294X.2007.03147.x,MOLECULAR ECOLOGY,ancient-dna,KF,RC,accept,accept,empirical,connectivity,diversity,,,no,terrestrial,Aves,Spain,Spain,"2001.01.01,1882.01.01","60,34",4866.5,opportunistic,anthropogenic,habitat_loss,disease,,chronic,mtDNA_seq,feather.toepad,NA,Qiagen DNeasy Tissue Kit,Sanger,PCR,"RC: 2001 represents midpoint between 2000-2002, 1882 represents midpoint between 1860-1904",,,,,,,,,
3386,,Archival DNA reveals cryptic biodiversity within Spotted Shag (Phalacrocorax punctatus) from New Zealand,"Rawlence, NJ; Rayner, MJ; Lovegrove, TG; Stoddart, D; Vermeulen, M; Easton, LJ; Tennyson, AJD; Scofield, RP; Kennedy, M; Spencer, H; Waters, JM","Genetic data are increasingly being used to prioritize species conservation in a fiscally constrained age of seemingly boundless conservation crises. Such data can also reveal previously cryptic biodiversity requiring further revision of conservation management guidelines. Using a combination of mitochondrial (control region) and nuclear (beta fibrinogen intron 7) DNA, and morphology, we reveal that the endemic New Zealand Spotted Shag (Phalacrocorax punctatus) complex exhibits phylogenetic structure that is decoupled from previously recorded qualitative morphological variation. Crucially, the most genetically distinct populations within P. punctatus are from northern New Zealand; recent surveys show that these populations, which house important genetic diversity within Spotted Shags, are in danger of being extirpated. In contrast, we find the previously phenotypically differentiated nominate (P. punctatus punctatus) and Blue (P. punctatus oliveri) Shag subspecies show no genetic and morphological separation, and are of least conservation concern.",nic.rawlence@otago.ac.nz,2019,10.1093/condor/duz029,CONDOR,adna,RC,AAS,reject,,,,,,,,,,,,,,,,,,,,,,,,,,,,,,,,,,,,
4286,,Phylogeography of amphi-boreal dish: tracing the history of the Pacific herring Clupea pallasii in North-East European Seas,"Laakkonen, HM; Lajus, DL; Strelkov, P; Vainola, R","Background: The relationships between North Atlantic and North Pacific faunas through times have been controlled by the variation of hydrographic circumstances in the intervening Arctic Ocean and Bering Strait. We address the history of trans-Arctic connections in a clade of amphi-boreal pelagic fishes using genealogical information from mitochondrial DNA sequence data. The Pacific and Atlantic herrings (Clupea pallasii and C. harengus) have basically vicarious distributions in the two oceans since pre-Pleistocene times. However, remote populations of C. pallasii are also present in the border waters of the North-East Atlantic in Europe. These populations show considerable regional and life history differentiation and have been recognized in subspecies classification. The chronology of the inter-oceanic invasions and genetic basis of the phenotypic structuring however remain unclear. Results: The Atlantic and Pacific herrings both feature high mtDNA diversities (large long-term population sizes) in their native basins, but an ocean-wide homogeneity of C. harengus is contrasted by deep east-west Pacific subdivision within Pacific C. pallasii. The outpost populations of C. pallasii in NE Europe are identified as members of the western Pacific C. pallasii clade, with some retained inter-oceanic haplotype sharing. They have lost diversity in colonization bottlenecks, but have also thereafter accumulated abundant new variation. The data delineate three phylogeographic groups within the European C. pallasii: herring from the inner White Sea; herring from the Mezen and Chesha Bays; and a strongly bottlenecked peripheral population in Balsfjord of the Norwegian Sea. Conclusions: The NE European outposts of C. pallasii are judged to be early post-glacial colonists from the NW Pacific. A strong regional substructure has evolved since that time, in contrast to the apparent broad-scale uniformity maintained by herrings in their native basins. The structure only partly matches the previous biological concepts based on seasonal breeding stocks or geographical subspecies designations. The trans-Arctic herring phylogeography is notably similar to those of the amphi-boreal mollusk taxa Macoma and Mytilus, suggesting similar histories of inter-oceanic connections. We also considered the time dependency of molecular rates, critical for interpreting timing of relatively recent biogeographical events, by comparing the estimates from coding and non-coding mitochondrial regions of presumably different mutation dynamics.",hanna.laakkonen@helsinki.fi,2013,10.1186/1471-2148-13-67,BMC EVOLUTIONARY BIOLOGY,historical-dna,RC,AAS,reject,,,,,,,,,,,,,,,,,,,,,,,,,,,,,,,,,,,,
4628,,Independen evolutionray histories in allopatric populations of a threatened Caribbean land mammal,"Turvey, ST; Peters, S; Brace, S; Young, RP; Crumpton, N; Hansford, J; Nunez-Mino, JM; King, G; Tsalikidis, K; Ottenwalder, JA; Timpson, A; Funk, SM; Brocca, JL; Thomas, MG; Barnes, I","AimTo determine the evolutionary history, relationships and distinctiveness of allopatric populations of Hispaniolan solenodon (Solenodon paradoxus), a highly threatened Caribbean relict' mammal, to understand spatio-temporal patterns of gene flow and the distribution of diversity across complex large island landscapes and inform spatial conservation prioritization. LocationHistorical and modern-day solenodon specimens were analysed from sampling localities across Hispaniola, representing this geotectonically complex island's distinct northern, south-eastern and south-western biogeographic provinces. MethodsWe successfully amplified mitochondrial cytochrome b and control region sequences from 34 solenodon samples. Bayesian phylogenetic analyses were applied to assess the relationship between these sequence data, and coalescent simulation and approximate Bayesian computation were used to identify which model of solenodon intra-island demographic history best explains the observed patterns of variation. We also conducted morphometric analysis of 110 solenodon specimens to investigate whether allopatric Hispaniolan populations can be differentiated using craniodental characteristics. ResultsUnique haplotypes were identified in solenodon samples from each biogeographic region, with no haplotype sharing between regions. Higher marginal posterior probability values were found for a three-population model comprising allopatric northern, south-eastern and south-western Hispaniolan populations, with exceptionally low migration rates inferred between all populations, indicating that they are genetically isolated. Modal estimates of long-term effective female population size are extremely low for south-western and south-eastern populations. Morphometric differentiation is observed between all three populations. Main conclusionsEvolutionary differentiation of Hispaniolan solenodons into three distinct populations is congruent with phylogenetic patterns observed in several other Hispaniolan species, with population isolation possibly associated with past marine transgression. We interpret these populations as distinct subspecies, with the two genetically impoverished southern subspecies particularly vulnerable to environmental change. Our improved understanding of Hispaniolan solenodon evolutionary history provides an important baseline for identifying wider patterns of intra-island diversification and prioritizing conservation attention for evolutionarily significant populations.",stuart.peters.13@ucl.ac.uk,2016,10.1111/ddi.12420,DIVERSITY AND DISTRIBUTIONS,temporal-genetics,RC,AAS,reject,,,,,,,,,,,,,,,,,,,,,,,,,,,,,,,,,,,,
8723,,Genetic patterns across an invasion's history: a test of change versus stasis for the Eurasian round goby in North America,"Snyder, MR; Stepien, CA","Biological invasions comprise accidental evolutionary experiments, whose genetic compositions underlie relative success, spread and persistence in new habitats. However, little is known about whether, or how, their population genetic patterns change temporally and/or spatially across the invasion's history. Theory predicts that most would undergo founder effect, exhibit low genetic divergence across the new range and gain variation over time via new arriving propagules. To test these predictions, we analyse population genetic diversity and divergence patterns of the Eurasian round goby Neogobius melanostomus across the two decades of its North American invasion in the Laurentian Great Lakes, comparing results from 13 nuclear DNA microsatellite lociand mitochondrial DNA cytochrome b sequences. We test whether genetic stasis', genetic replacement' and/or genetic supplement' scenarios have occurred at the invasion's core and expansion sites, in comparison with its primary native source population in the Dnieper River, Black Sea. Results reveal pronounced genetic divergence across the exotic range, with population areas remaining genetically distinct and statistically consistent across two decades, supporting genetic stasis' and founder takes most'. The original genotypes continue to predominate, whose high population growth likely outpaced the relative success of later arrivals. The original invasion core has stayed the most similar to the native source. Secondary expansion sites indicate slight allelic composition convergence towards the core population over time, attributable to some early genetic supplementation'. The geographic and temporal coverage of this investigation offers a rare opportunity to discern population dynamics over time and space in context of invasion genetic theory vs. reality.",carol.stepien@noaa.gov,2017,10.1111/mec.13997,MOLECULAR ECOLOGY,temporal-genetics,RC,AAS,accept,accept,empirical,connectivity,diversity,,,,freshwater,Actinopterygii,"United States, Ukraine","Saint Clair River,Lake Saint Clair.Lake Errie Islands.Central Lake Erie,Lake Michigan,Lake Erie Islands.Central Lake Erie.Dnieper River Black Sea,Lake Erie Islands,Lake Michigan.Saint Clair River.Lake Saint Clair.Lake Erie Islands.Central Lake Erie.Dnieper River Black Sea,Lake Michigan.Saint Clair River.Lake Erie Islands.Central Lake Erie,Lake Michigan.Saint Clair River.Lake Saint Clair.Lake Erie Islands.Central Lake Erie.Dnieper River Black Sea ","1993.01.01,1998.01.01,1999.01.01,2002.01.01,2005.01.01,2007.01.01,2011.01.01,2013.01.01","45,39.51.24,19,50.29.25,49,50.50.50.40.50.25,44.34.32.45.48,50.50.50.50.50.53",730,pre-designed,natural,invasive_species,,,chronic,mtDNA_seq,fin,ethanol,DNeasy Tissue Kit (Qiagen),ABI 3730 DNA automated sequencer,PCR,Generation time: MacInnis & Corkum 2000; invasive species,,,,,,,,,
8723,,Genetic patterns across an invasion's history: a test of change versus stasis for the Eurasian round goby in North America,"Snyder, MR; Stepien, CA","Biological invasions comprise accidental evolutionary experiments, whose genetic compositions underlie relative success, spread and persistence in new habitats. However, little is known about whether, or how, their population genetic patterns change temporally and/or spatially across the invasion's history. Theory predicts that most would undergo founder effect, exhibit low genetic divergence across the new range and gain variation over time via new arriving propagules. To test these predictions, we analyse population genetic diversity and divergence patterns of the Eurasian round goby Neogobius melanostomus across the two decades of its North American invasion in the Laurentian Great Lakes, comparing results from 13 nuclear DNA microsatellite lociand mitochondrial DNA cytochrome b sequences. We test whether genetic stasis', genetic replacement' and/or genetic supplement' scenarios have occurred at the invasion's core and expansion sites, in comparison with its primary native source population in the Dnieper River, Black Sea. Results reveal pronounced genetic divergence across the exotic range, with population areas remaining genetically distinct and statistically consistent across two decades, supporting genetic stasis' and founder takes most'. The original genotypes continue to predominate, whose high population growth likely outpaced the relative success of later arrivals. The original invasion core has stayed the most similar to the native source. Secondary expansion sites indicate slight allelic composition convergence towards the core population over time, attributable to some early genetic supplementation'. The geographic and temporal coverage of this investigation offers a rare opportunity to discern population dynamics over time and space in context of invasion genetic theory vs. reality.",carol.stepien@noaa.gov,2017,10.1111/mec.13997,MOLECULAR ECOLOGY,temporal-genetics,RC,AAS,accept,accept,empirical,connectivity,diversity,,,,freshwater,Actinopterygii,"United States, Ukraine","Saint Clair River,Lake Saint Clair.Lake Errie Islands.Central Lake Erie,Lake Michigan,Lake Erie Islands.Central Lake Erie.Dnieper River Black Sea,Lake Erie Islands,Lake Michigan.Saint Clair River.Lake Saint Clair.Lake Erie Islands.Central Lake Erie.Dnieper River Black Sea,Lake Michigan.Saint Clair River.Lake Erie Islands.Central Lake Erie,Lake Michigan.Saint Clair River.Lake Saint Clair.Lake Erie Islands.Central Lake Erie.Dnieper River Black Sea ","1993.01.01,1998.01.01,1999.01.01,2002.01.01,2005.01.01,2007.01.01,2011.01.01,2013.01.01","45,39.51.24,19,50.29.25,49,50.50.50.40.50.25,44.34.32.45.48,50.50.50.50.50.53",730,pre-designed,natural,invasive_species,,,chronic,microsat,fin,ethanol,DNeasy Tissue Kit (Qiagen),ABI 3130 automated sequencer,PCR,Generation time: MacInnis & Corkum 2000; invasive species,,,,,,,,,
10640,,"Genetic diversity of endangered brown bear (Ursus arctos) populations at the crossroads of Europe, Asia, and Africa","Calvignac, S; Hughes, S; Hanni, C","Aim Middle East brown bears (Ursus arctos syriacus Hemprich and Ehrenberg, 1828) are presently on the edge of extinction. However, little is known of their genetic diversity. This study investigates that question as well as that of Middle East brown bear relationships to surrounding populations of the species. Location Middle East region of south-western Asia. Methods We performed DNA analyses on 27 brown bear individuals. Twenty ancient bone samples (Late Pleistocene to 20th century) from natural populations and seven present-day samples obtained from captive individuals were analysed. Results Phylogenetic analyses of the mitochondrial sequences obtained from seven ancient specimens identify three distinct maternal clades, all unrelated to one recently described from North Africa. Brown bears from Iran exhibit striking diversity (three individuals, three haplotypes) and form a unique clade that cannot be linked to any extant one. Individuals from Syria belong to the Holarctic clade now observed in Eastern Europe, Turkey, Japan and North America. Specimens from Lebanon surprisingly appear as tightly linked to the clade of brown bears now in Western Europe. Moreover, we show that U. a. syriacus in captivity still harbour haplotypes closely linked to those found in ancient individuals. Main conclusion This study brings important new information on the genetic diversity of brown bear populations at the crossroads of Europe, Asia and Africa. It reveals a high level of diversity in Middle East brown bears and extends the historical distribution of the Western European clade to the East. Our analyses also suggest the value of a specific breeding programme for captive populations.",catherine.hanni@ens-lyon.fr,2009,10.1111/j.1472-4642.2009.00586.x,DIVERSITY AND DISTRIBUTIONS,ancient-dna,RC,AAS,reject,ancient,,,,,,,,,,,,,,,,,,,,,,,,,,,,,,,,,,,
4767,,"Using genetic variation to infer associations with climate in the common frog, Rana temporaria","Muir, AP; Thomas, R; Biek, R; Mable, BK","Recent and historical species' associations with climate can be inferred using molecular markers. This knowledge of population and species-level responses to climatic variables can then be used to predict the potential consequences of ongoing climate change. The aim of this study was to predict responses of Rana temporaria to environmental change in Scotland by inferring historical and contemporary patterns of gene flow in relation to current variation in local thermal conditions. We first inferred colonization patterns within Europe following the last glacial maximum by combining new and previously published mitochondrial DNA sequences. We found that sequences from our Scottish samples were identical to (92%), or clustered with, the common haplotype previously identified from Western Europe. This clade showed very low mitochondrial variation, which did not allow inference of historical colonization routes but did allow interpretation of patterns of current fine-scale population structure without consideration of confounding historical variation. Second, we assessed fine-scale microsatellite-based patterns of genetic variation in relation to current altitudinal temperature gradients. No population structure was found within altitudinal gradients (average F-ST=0.02), despite a mean annual temperature difference of 4.5 degrees C between low- and high-altitude sites. Levels of genetic diversity were considerable and did not vary between sites. The panmictic population structure observed, even along temperature gradients, is a potentially positive sign for R.temporaria persistence in Scotland in the face of a changing climate. This study demonstrates that within taxonomic groups, thought to be at high risk from environmental change, levels of vulnerability can vary, even within species.",a.muir.2@research.gla.ac.uk,2013,10.1111/mec.12334,MOLECULAR ECOLOGY,historical-dna,JW,AAS,reject,accept,,,,,,,,,,,,,,,,,,,,,,,,,,,,,,,,,,,
6504,,Isolation by environment in the highly mobile olive ridley turtle (Lepidochelys olivacea) in the eastern Pacific,"Rodriguez-Zarate, CJ; Sandoval-Castillo, J; van Sebille, E; Keane, RG; Rocha-Olivares, A; Urteaga, J; Beheregaray, LB","Spatial and temporal scales at which processes modulate genetic diversity over the landscape are usually overlooked, impacting the design of conservation management practices for widely distributed species. We examine processes shaping population divergence in highly mobile species by reassessing the case of panmixia in the iconic olive ridley turtle from the eastern Pacific. We implemented a biophysical model of connectivity and a seascape genetic analysis based on nuclear DNA variation of 634 samples collected from 27 nesting areas. Two genetically distinct populations largely isolated during reproductive migrations and mating were detected, each composed of multiple nesting sites linked by high connectivity. This pattern was strongly associated with a steep environmental gradient and also influenced by ocean currents. These findings relate to meso-scale features of a dynamic oceanographic interface in the eastern tropical Pacific (ETP) region, a scenario that possibly provides different cost-benefit solutions and selective pressures for sea turtles during both the mating and migration periods. We reject panmixia and propose a new paradigm for olive ridley turtles where reproductive isolation due to assortative mating is linked to its environment. Our study demonstrates the relevance of integrative approaches for assessing the role of environmental gradients and oceanographic currents as drivers of genetic differentiation in widely distributed marine species. This is relevant for the conservation management of species of highly mobile behaviour, and assists the planning and development of large-scale conservation strategies for the threatened olive ridley turtles in the ETP.",luciano.beheregaray@flinders.edu.au,2018,10.1098/rspb.2018.0264,PROCEEDINGS OF THE ROYAL SOCIETY B-BIOLOGICAL SCIENCES,temporal-genetics,JW,AAS,reject,non-temporal,,,,,,,,,,,,,,,,,,,,,,,,,,Uses samples from multple years but lumps them together. Analysis not temporal,,,,,,,,,
6522,,Genetic analyses reveal complex dynamics within a marine fish management area,"Hemmer-Hansen, J; Hussy, K; Baktoft, H; Huwer, B; Bekkevold, D; Haslob, H; Herrmann, JP; Hinrichsen, HH; Krumme, U; Mosegaard, H; Nielsen, EE; Reusch, TBH; Storr-Paulsen, M; Velasco, A; von Dewitz, B; Dierking, J; Eero, M","Genetic data have great potential for improving fisheries management by identifying the fundamental management units-that is, the biological populations-and their mixing. However, so far, the number of practical cases of marine fisheries management using genetics has been limited. Here, we used Atlantic cod in the Baltic Sea to demonstrate the applicability of genetics to a complex management scenario involving mixing of two genetically divergent populations. Specifically, we addressed several assumptions used in the current assessment of the two populations. Through analysis of 483 single nucleotide polymorphisms (SNPs) distributed across the Atlantic cod genome, we confirmed that a model of mechanical mixing, rather than hybridization and introgression, best explained the pattern of genetic differentiation. Thus, the fishery is best monitored as a mixed-stock fishery. Next, we developed a targeted panel of 39 SNPs with high statistical power for identifying population of origin and analyzed more than 2,000 tissue samples collected between 2011 and 2015 as well as 260 otoliths collected in 2003/2004. These data provided high spatial resolution and allowed us to investigate geographical trends in mixing, to compare patterns for different life stages and to investigate temporal trends in mixing. We found similar geographical trends for the two time points represented by tissue and otolith samples and that a recently implemented geographical management separation of the two populations provided a relatively close match to their distributions. In contrast to the current assumption, we found that patterns of mixing differed between juveniles and adults, a signal likely linked to the different reproductive dynamics of the two populations. Collectively, our data confirm that genetics is an operational tool for complex fisheries management applications. We recommend focussing on developing population assessment models and fisheries management frameworks to capitalize fully on the additional information offered by genetically assisted fisheries monitoring.",jhh@aqua.dtu.dk,2019,10.1111/eva.12760,EVOLUTIONARY APPLICATIONS,temporal-genetics,JW,AAS,accept,accept,empirical,connectivity,diversity,,,,marine,Actinopterygii,"Denmark,Germany,Sweden,Poland","Western,Eastern,Mixing Zone,Mixing Zone,Eastern,Western,Mixing Zone,Eastern, Western,Mixing Zone,Mixing Zone,Mixing Zone,Mixing Zone,Mixing Zone,Mixing Zone,Mixing Zone,Mixing Zone,Mixing Zone,Mixing Zone","1996.02.01,1997.04.01,2003.01.01,2004.01.01,2007.02.01,2007.03.01,2011.06.01,2012.01.01,2012.02.01,2013.07.01,2013.11.01,2014.02.01,2014.04.01,2014.08.01,2014.10.01,2015.02.01,2015.07.01,2015.09.01","40,40,128,132,40,37,536,150,150,41,150,150,21,289,145,229,236,90,155",1825,opportunistic,natural,env_variation,,,acute,SNP,bone,dried,Bonanomi et al. 2015,Fluid Biomark HD System,GBS,"Generation time: Therkildsen et al., 2013 supplementary",,,,,,,,,
